{
  "schema_version": "1.0.0",
  "relationship_id": "0192a1b2-c3d4-7e5f-8a9b-0c1d2e3f4a70",
  "from_contact_id": "0192a1b2-c3d4-7e5f-8a9b-0c1d2e3f4a60",
  "to_contact_id": "0192a1b2-c3d4-7e5f-8a9b-0c1d2e3f4a63",
  "types": ["colleague"],
  "tie_strength": { "band": "moderate", "last_contact_utc": "2026-08-20T09:00:00Z" },
  "evidence_ids": ["0192a1b2-c3d4-7e5f-8a9b-0c1d2e3f4a10"],
  "egress_scope": "local_only"
}
